"Description","Eligible User Types","Hide","Short Description","Thumbnail","Title","Creation Date"
"[START HERE] Welcome! Follow the steps in this course to get started on your journey","(deleted option) , Premium , (deleted option) , Free","no","[START HERE] Welcome! Follow the steps in this course to get started on your journey","//119e394564295cd17eff6c1a28e68b43.cdn.bubble.io/f1715872910206x572660920575375000/revamp.jpg","Where to Get Started","May 16, 2024 8:52 pm"
"Leverage filters and sorting to find your needle in the haystack and do more deals","(deleted option) , Premium , (deleted option)","no","Leverage filters and sorting to find your needle in the haystack and do more deals","//119e394564295cd17eff6c1a28e68b43.cdn.bubble.io/f1715627404071x821974886374178300/WhatsApp%20Image%202024-05-13%20at%2013.46.40_7e843d3b.jpg","Filters & Sorting","May 16, 2024 8:59 pm"
"Master the platform and become a deal magnet. You will become the source of","(deleted option) , Premium , (deleted option)","no","Master the platform and become a deal magnet. You will become the source of","//119e394564295cd17eff6c1a28e68b43.cdn.bubble.io/f1715627368290x383950207606176240/WhatsApp%20Image%202024-05-13%20at%2013.46.39_66e772e12.jpg","Advanced 101","May 16, 2024 8:59 pm"
"See how listing your wholesale deals here can increase your deal size and speed of ","Premium , (deleted option)","no","See how listing your wholesale deals here can increase your deal size and speed of ","//119e394564295cd17eff6c1a28e68b43.cdn.bubble.io/f1715627500071x575665056897940200/WhatsApp%20Image%202024-05-12%20at%2014.41.13_074d55b92.jpg","Sell YOUR Deals","May 16, 2024 8:59 pm"
"Earn through our partnership program. Build recurring income for the life of membership","Free , (deleted option) , Premium , (deleted option)","no","Earn through our partnership program. Build recurring income for the life of membership","//119e394564295cd17eff6c1a28e68b43.cdn.bubble.io/f1716918523951x134097587581531570/affiliate%20training%20thumbnail.png","Affiliate Partnerships","May 28, 2024 10:44 pm"
"Learn how to send signed offers in seconds. This training covers every step—from building your offer list, to setting your price using AI-powered guidance, to generating and emailing a fully executed Agreement of Sale directly from the platform.","","","Send signed offers in seconds with AI-powered guidance and automated contracts.","//119e394564295cd17eff6c1a28e68b43.cdn.bubble.io/f1743653498453x168785012950373630/automated%20offers%20thumbnail.png","Automated Offers","Apr 3, 2025 9:41 am"
